{
 "schema_version": 1,
 "retrieved": "2026-10-22",
 "description": "Public benchmark priors per catalogue model and effort. Priors only; never acceptance evidence. See README.md.",
 "records": [
  {
   "id": "claude-opus-5-5.low.aa-intelligence-index",
   "model_id": "claude-opus-5-5",
   "catalogue": true,
   "effort": "low",
   "benchmark": "AA Intelligence Index",
   "metric": "index_points",
   "score": 42,
   "cost_per_task_usd": 0.55,
   "tokens_per_task": 10000,
   "harness": "Artificial Analysis Intelligence Index harness (not a coding agent scaffold)",
   "source_url": "https://artificialanalysis.ai/models/claude-opus-5-5-low",
   "source_date": null,
   "retrieved": "2026-10-22",
   "run_by": "independent",
   "confidence": "H",
   "contamination_note": "Aggregate of public and private evals; not coding-specific; AA states some components are held out. Index versions change, so compare only within one snapshot.",
   "task_class_hint": null,
   "notes": "Cost is per Intelligence Index task, not per coding task. Live page is undated; retrieved date is the freshness anchor. Output tokens per task 10k (comparison page). Earlier secondary reports of 39 or 51 for a low variant were not reproduced; this primary page supersedes them.",
   "tokens_total_run": "20M"
  },
  {
   "id": "claude-opus-5-5.medium.aa-intelligence-index",
   "model_id": "claude-opus-5-5",
   "catalogue": true,
   "effort": "medium",
   "benchmark": "AA Intelligence Index",
   "metric": "index_points",
   "score": 51,
   "cost_per_task_usd": 1.34,
   "tokens_per_task": null,
   "harness": "Artificial Analysis Intelligence Index harness (not a coding agent scaffold)",
   "source_url": "https://artificialanalysis.ai/models/claude-opus-5-5-medium",
   "source_date": null,
   "retrieved": "2026-10-22",
   "run_by": "independent",
   "confidence": "H",
   "contamination_note": "Aggregate of public and private evals; not coding-specific; AA states some components are held out. Index versions change, so compare only within one snapshot.",
   "task_class_hint": null,
   "notes": "Cost is per Intelligence Index task, not per coding task. Live page is undated; retrieved date is the freshness anchor.",
   "tokens_total_run": "38M"
  },
  {
   "id": "claude-opus-5-5.high.aa-intelligence-index",
   "model_id": "claude-opus-5-5",
   "catalogue": true,
   "effort": "high",
   "benchmark": "AA Intelligence Index",
   "metric": "index_points",
   "score": 54,
   "cost_per_task_usd": 1.82,
   "tokens_per_task": null,
   "harness": "Artificial Analysis Intelligence Index harness (not a coding agent scaffold)",
   "source_url": "https://artificialanalysis.ai/models/claude-opus-5-5-high",
   "source_date": null,
   "retrieved": "2026-10-22",
   "run_by": "independent",
   "confidence": "H",
   "contamination_note": "Aggregate of public and private evals; not coding-specific; AA states some components are held out. Index versions change, so compare only within one snapshot.",
   "task_class_hint": null,
   "notes": "Cost is per Intelligence Index task, not per coding task. Live page is undated; retrieved date is the freshness anchor.",
   "tokens_total_run": "53M"
  },
  {
   "id": "claude-opus-5-5.xhigh.aa-intelligence-index",
   "model_id": "claude-opus-5-5",
   "catalogue": true,
   "effort": "xhigh",
   "benchmark": "AA Intelligence Index",
   "metric": "index_points",
   "score": 56,
   "cost_per_task_usd": 3.46,
   "tokens_per_task": null,
   "harness": "Artificial Analysis Intelligence Index harness (not a coding agent scaffold)",
   "source_url": "https://artificialanalysis.ai/models/claude-opus-5-5-xhigh",
   "source_date": null,
   "retrieved": "2026-10-22",
   "run_by": "independent",
   "confidence": "H",
   "contamination_note": "Aggregate of public and private evals; not coding-specific; AA states some components are held out. Index versions change, so compare only within one snapshot.",
   "task_class_hint": null,
   "notes": "Cost is per Intelligence Index task, not per coding task. Live page is undated; retrieved date is the freshness anchor.",
   "tokens_total_run": "100M"
  },
  {
   "id": "claude-opus-5-5.max.aa-intelligence-index",
   "model_id": "claude-opus-5-5",
   "catalogue": true,
   "effort": "max",
   "benchmark": "AA Intelligence Index",
   "metric": "index_points",
   "score": 58,
   "cost_per_task_usd": 5.98,
   "tokens_per_task": 119000,
   "harness": "Artificial Analysis Intelligence Index harness (not a coding agent scaffold)",
   "source_url": "https://artificialanalysis.ai/models/claude-opus-5-5",
   "source_date": "2026-09-22",
   "retrieved": "2026-10-22",
   "run_by": "independent",
   "confidence": "H",
   "contamination_note": "Aggregate of public and private evals; not coding-specific; AA states some components are held out. Index versions change, so compare only within one snapshot.",
   "task_class_hint": null,
   "notes": "Cost is per Intelligence Index task, not per coding task. Live page is undated; retrieved date is the freshness anchor. Article of 2026-09-22 states ~119k output tokens per task at max.",
   "tokens_total_run": "260M"
  },
  {
   "id": "claude-opus-5-5.low.terminal-bench-4.0",
   "model_id": "claude-opus-5-5",
   "catalogue": true,
   "effort": "low",
   "benchmark": "Terminal-Bench 4.0",
   "metric": "pct_resolved",
   "score": 31,
   "cost_per_task_usd": null,
   "tokens_per_task": null,
   "harness": "Artificial Analysis (harness not stated on the comparison page)",
   "source_url": "https://artificialanalysis.ai/models/comparisons/claude-opus-5-5-low-vs-claude-sonnet-5",
   "source_date": null,
   "retrieved": "2026-10-22",
   "run_by": "independent",
   "confidence": "M",
   "contamination_note": "Public task set; 66 tasks. Vendor and leaderboard runs differ by harness, so scores are not interchangeable.",
   "task_class_hint": "implementation",
   "notes": "Single comparison-page figure; Sonnet 5 (max) shows 14% on the same page."
  },
  {
   "id": "claude-opus-5-5.xhigh.terminal-bench-4.0",
   "model_id": "claude-opus-5-5",
   "catalogue": true,
   "effort": "xhigh",
   "benchmark": "Terminal-Bench 4.0",
   "metric": "pct_resolved",
   "score": 59.6,
   "cost_per_task_usd": null,
   "tokens_per_task": null,
   "harness": "mini-swe-agent, pass@1 averaged over 3 repeats",
   "source_url": "https://artificialanalysis.ai/evaluations/terminalbench-4-0",
   "source_date": null,
   "retrieved": "2026-10-22",
   "run_by": "independent",
   "confidence": "H",
   "contamination_note": "Public task set; 66 tasks. Vendor and leaderboard runs differ by harness, so scores are not interchangeable.",
   "task_class_hint": "implementation",
   "notes": ""
  },
  {
   "id": "claude-opus-5-5.max.terminal-bench-4.0",
   "model_id": "claude-opus-5-5",
   "catalogue": true,
   "effort": "max",
   "benchmark": "Terminal-Bench 4.0",
   "metric": "pct_resolved",
   "score": 59.6,
   "cost_per_task_usd": null,
   "tokens_per_task": null,
   "harness": "mini-swe-agent, pass@1 averaged over 3 repeats",
   "source_url": "https://artificialanalysis.ai/evaluations/terminalbench-4-0",
   "source_date": null,
   "retrieved": "2026-10-22",
   "run_by": "independent",
   "confidence": "H",
   "contamination_note": "Public task set; 66 tasks. Vendor and leaderboard runs differ by harness, so scores are not interchangeable.",
   "task_class_hint": "implementation",
   "notes": "Equals xhigh: max buys nothing on this benchmark."
  },
  {
   "id": "claude-opus-5-5.max.terminal-bench-4.0.2",
   "model_id": "claude-opus-5-5",
   "catalogue": true,
   "effort": "max",
   "benchmark": "Terminal-Bench 4.0",
   "metric": "pct_resolved",
   "score": 64.8,
   "cost_per_task_usd": null,
   "tokens_per_task": null,
   "harness": "Vendor CLI agent (see model row): Claude Code",
   "source_url": "https://snorkel.ai/leaderboard/terminal-bench/",
   "source_date": "2026-09-22",
   "retrieved": "2026-10-22",
   "run_by": "independent",
   "confidence": "H",
   "contamination_note": "Public task set; 66 tasks. Vendor and leaderboard runs differ by harness, so scores are not interchangeable.",
   "task_class_hint": "implementation",
   "notes": "Leaderboard cost and tokens are totals for the whole run, not per task, and are not normalised for effort: $4.7k, 8.0B tokens. CI +/-3.1."
  },
  {
   "id": "claude-opus-5-5.xhigh.terminal-bench-4.0.2",
   "model_id": "claude-opus-5-5",
   "catalogue": true,
   "effort": "xhigh",
   "benchmark": "Terminal-Bench 4.0",
   "metric": "pct_resolved",
   "score": 66.4,
   "cost_per_task_usd": null,
   "tokens_per_task": null,
   "harness": "Anthropic internal; harness not stated",
   "source_url": "https://www.anthropic.com/news/claude-sonnet-5-5",
   "source_date": "2026-09-28",
   "retrieved": "2026-10-22",
   "run_by": "vendor",
   "confidence": "M",
   "contamination_note": "Public task set; 66 tasks. Vendor and leaderboard runs differ by harness, so scores are not interchangeable.",
   "task_class_hint": "implementation",
   "notes": "Anthropic launch table for Sonnet 5.5, Opus 5.5 column."
  },
  {
   "id": "claude-opus-5-5.na.cursorbench-4.0",
   "model_id": "claude-opus-5-5",
   "catalogue": true,
   "effort": null,
   "benchmark": "CursorBench 4.0",
   "metric": "pct",
   "score": 57.8,
   "cost_per_task_usd": null,
   "tokens_per_task": null,
   "harness": "Anthropic internal; harness not stated",
   "source_url": "https://www.anthropic.com/news/claude-sonnet-5-5",
   "source_date": "2026-09-28",
   "retrieved": "2026-10-22",
   "run_by": "vendor",
   "confidence": "M",
   "contamination_note": "Cursor-authored benchmark; contamination status not stated.",
   "task_class_hint": "implementation",
   "notes": "Effort not stated."
  },
  {
   "id": "claude-sonnet-5-5.medium.aa-intelligence-index",
   "model_id": "claude-sonnet-5-5",
   "catalogue": true,
   "effort": "medium",
   "benchmark": "AA Intelligence Index",
   "metric": "index_points",
   "score": 41,
   "cost_per_task_usd": 0.48,